"Story","Title","Result","Date","Stability","Duration (s)"
"List","Test get list detail","SUCCESS","2020-03-09T09:38:30.071-05:00[America/Bogota]","0.0","8.26"
"List","Test create a list","SUCCESS","2020-03-09T09:38:38.34-05:00[America/Bogota]","0.0","4.83"
"List","Test delete of a list","FAILURE","2020-03-09T09:38:43.174-05:00[America/Bogota]","0.0","4.5"
"List","Test add a movie to a list","SUCCESS","2020-03-09T09:38:47.822-05:00[America/Bogota]","0.0","4.59"
"List","Test delete a movie from a list","SUCCESS","2020-03-09T09:38:52.424-05:00[America/Bogota]","0.0","4.34"
"List","Test to clear a list","SUCCESS","2020-03-09T09:38:56.765-05:00[America/Bogota]","0.0","4.57"
"List","Test get check that a movie is in a list","SUCCESS","2020-03-09T09:39:01.346-05:00[America/Bogota]","0.0","4.27"
