"Story","Title","Result","Date","Stability","Duration (s)"
"List","Test get list detail","SUCCESS","2020-03-06T15:43:07.279-05:00[America/Bogota]","0.0","4.51"
"List","Test create a list","FAILURE","2020-03-06T15:43:11.797-05:00[America/Bogota]","0.0","3.83"
"List","Test delete of a list","FAILURE","2020-03-06T15:43:15.991-05:00[America/Bogota]","0.0","4.42"
"List","Test add a movie to a list","SUCCESS","2020-03-06T15:43:20.421-05:00[America/Bogota]","0.0","4.41"
"List","Test delete a movie from a list","FAILURE","2020-03-06T15:43:24.831-05:00[America/Bogota]","0.0","3.49"
"List","Test to clear a list","SUCCESS","2020-03-06T15:43:28.328-05:00[America/Bogota]","0.0","4.34"
"List","Test get check that a movie is in a list","FAILURE","2020-03-06T15:43:32.672-05:00[America/Bogota]","0.0","3.44"
